id,created_at,text,hashtags,retweets
1120637539919040512,2019-04-23 10:36:24,Bei sexualisierter Gewalt in Krisen kommen die Täter oft straflos davon und die Opfer finden zu wenig Unterstützung… https://t.co/4mqK75wQg2,[],37
1120417206532177920,2019-04-22 20:00:53,"Sexualisierte Gewalt ist weltweit ein Mittel des Kriegs und des Terrors. Wie wir den Betroffenen helfen müssen, hab… https://t.co/lD2tl8Trz4",[],76
1119878306747363328,2019-04-21 08:19:29,Frohe Ostern! https://t.co/wfyscqILIv,[],95
1119863538288402432,2019-04-21 07:20:48,Die Nachrichten aus #SriLanka machen fassungslos. Wir sind in Gedanken bei den Angehörigen der Opfer und hoffen mit… https://t.co/FDnrwzhYuq,"[{'text': 'SriLanka', 'indices': [20, 29]}]",257
1118980158239600640,2019-04-18 20:50:34,"Wir setzen alles daran, dass die Verletzten gesund werden und sobald es möglich ist, nach Deutschland überführt wer… https://t.co/fxyLD8NELP",[],11
1118980154167037958,2019-04-18 20:50:33,"Wir in Deutschland trauern mit den Angehörigen, die ihre Liebsten in #Madeira verloren haben. Unsere Gedanken sind… https://t.co/yAp8lnePiy","[{'text': 'Madeira', 'indices': [69, 77]}]",32
1118822994745397248,2019-04-18 10:26:03,Für viele Menschen ist der Osterurlaub auf #Madeira zur Tragödie geworden. Ich werde heute mit einem Team von Ärzte… https://t.co/L0LTsrYnIi,"[{'text': 'Madeira', 'indices': [43, 51]}]",26
1118763466855211008,2019-04-18 06:29:30,"Das tragische Busunglück auf #Madeira erschüttert uns schwer. Wir müssen davon ausgehen, dass unter den Opfern viel… https://t.co/SIuxhlzHlP","[{'text': 'Madeira', 'indices': [29, 37]}]",40
1118503091748376576,2019-04-17 13:14:52,"Ob Digitalisierung, Migration oder Klimawandel - die Herausforderungen unserer Zeit kann kein einziger Staat allein… https://t.co/T4nOtpY1ON",[],73
1118062777153802240,2019-04-16 08:05:13,Präsident @EmmanuelMacron hat zu Hilfe für den Wiederaufbau von #NotreDame weit über Frankreich hinaus aufgerufen.… https://t.co/68733dpDkn,"[{'text': 'NotreDame', 'indices': [64, 74]}]",142
1117845514991566860,2019-04-15 17:41:53,Die brennende #NotreDame trifft auch uns ins Herz. Unsere Gedanken sind bei allen Einsatzkräften und unseren franzö… https://t.co/g22WSJr2Jm,"[{'text': 'NotreDame', 'indices': [14, 24]}]",304
1117770976169734145,2019-04-15 12:45:42,EU-BürgerInnen können überall in der EU an der Europawahl teilnehmen! Aber beachten: Wer in einem anderen EU-Land a… https://t.co/4f7NkFHqBu,[],38
1116341458993393664,2019-04-11 14:05:19,Unsere SoldatInnen schaffen in Mali Sicherheit und bilden malische Streitkräfte für nachhaltigen Frieden aus. Ich b… https://t.co/T8ULb8nMQx,[],13
1116255785544294400,2019-04-11 08:24:52,"Frieden kann es dauerhaft nur geben, wenn es gerecht zugeht. Das ist der Grundsatz der Internationalen Arbeitsorgan… https://t.co/NdeWv2m64Y",[],33
1115959407769194496,2019-04-10 12:47:10,"In vielen Ländern können Wissenschaftler nicht ungehindert arbeiten, auch in manchen europäischen Ländern gibt es b… https://t.co/KWGQIQidHm",[],15
1115904641081008128,2019-04-10 09:09:33,"Gemeinsam mit den @UN haben wir Starthilfe für die „Peace Support Facility for Yemen“ geleistet, um vertrauensbilde… https://t.co/wr9w6SZ5IQ",[],11
1115904639591960577,2019-04-10 09:09:33,"Der Waffenstillstand in Hodeidah, Jemen, ist und bleibt zentral für den Einstieg in einen Friedensprozess, für die… https://t.co/LNfDpBoW1E",[],18
1115884197745496069,2019-04-10 07:48:19,Eine Ära geht zu Ende. Dirk #Nowitzki war nicht allein auf dem Platz pure Weltklasse. #Fairness und #Respekt hat er… https://t.co/iAYPYxDToo,"[{'text': 'Nowitzki', 'indices': [28, 37]}, {'text': 'Fairness', 'indices': [86, 95]}, {'text': 'Respekt', 'indices': [100, 108]}]",8
1115869487851610113,2019-04-10 06:49:52,3500 Leute starben im Nordirlandkonflikt. Die Grenzposten waren eins der Hauptangriffsziele. Erst mit dem… https://t.co/D8WyDzJgA5,[],51
1115600594452893696,2019-04-09 13:01:23,"Dietrich Bonhoeffer, Wilhelm Canaris, Ludwig Gehre, Hans Oster und Karl Sack waren im Widerstand gegen die Nazis. A… https://t.co/3rtP8l8Dkh",[],152
1115569278193893376,2019-04-09 10:56:56,Seit vielen Wochen lassen uns junge Leute bei #Fridaysforfuture alt aussehen. Wir alle müssen uns ändern. Es geht u… https://t.co/asrKIBiX1q,"[{'text': 'Fridaysforfuture', 'indices': [46, 63]}]",363
1114806333243633664,2019-04-07 08:25:16,Die Ermordung hunderttausender Tutsi und Hutu war ein Verbrechen unvorstellbaren Ausmaßes. Der Völkermord vor 25 Ja… https://t.co/3GgXBr4P98,[],103
1114139838947704833,2019-04-05 12:16:51,Luigi Toscano reist für unser Projekt @wunderbar2gethr mit seinen Fotografien von Holocaust-Überlebenden durch die… https://t.co/Y1x7lUwTPb,[],6
1114108783406518272,2019-04-05 10:13:27,"„Tell me more about Energiewende.“ Diesen Satz höre ich oft, für viele Länder sind wir hier Vorreiter. Wir werden d… https://t.co/1AEcfjzsMb",[],24
1114080327406895105,2019-04-05 08:20:23,"Klimapolitik ist keine reine Umweltpolitik. Sie ist Wirtschafts-, Gesundheits-, aber auch Sicherheits- und Außenpol… https://t.co/3Jd9i5lAKz",[],38
1113739485353730048,2019-04-04 09:46:00,Die @NATO ist die erfolgreichste Verteidigungsallianz der Geschichte. Ohne sie hätte Deutschland nicht das bekommen… https://t.co/ZGvcsv6Pvo,[],41
1113728421903781889,2019-04-04 09:02:02,"Wir dürfen das Feld nicht denen überlassen, die den Menschen Angst vor Europa machen wollen. #1EuropafuerAlle bra… https://t.co/QG9cRJhIEo","[{'text': '1EuropafuerAlle', 'indices': [95, 111]}]",107
1113559147738542080,2019-04-03 21:49:24,Germany wholeheartedly supports the #NATO alliance. We will stand by our commitments. We must and will stand united… https://t.co/7pL9s20aSx,"[{'text': 'NATO', 'indices': [36, 41]}]",38
1113472219743649793,2019-04-03 16:03:59,Fritz Bauer war einer der größten Helden der deutschen Justiz - ein Verteidiger unserer Menschlichkeit. In New York… https://t.co/mBoGrp3hap,[],46
1113460056702558212,2019-04-03 15:15:39,"On both sides of the Atlantic, the last 70 years have shown how valuable strong alliances are. Never alone. That’s… https://t.co/o8BuI6pgb7",[],36
1113197418613493760,2019-04-02 21:52:01,"Wir haben heute im Sicherheitsrat ein Statement verabschiedet, das die Errungenschaften des Nichtverbreitungsvertra… https://t.co/3Ow0QZNCz8",[],25
1113110316961984512,2019-04-02 16:05:54,Der Abbau der nuklearen Arsenale ist zum Erliegen gekommen. Schlimmer noch: Uns droht erstmals eine gegenläufige En… https://t.co/vcoJ3hSXpE,[],19
1113041309126799365,2019-04-02 11:31:42,Frankreich und wir haben unsere Präsidentschaften im Sicherheitsrat gemeinsam erarbeitet und eng aufeinander abgest… https://t.co/EOSSQePJbD,[],25
1113004691858878465,2019-04-02 09:06:11,"Dass im Sicherheitsrat seit 2012 nicht mehr über nukleare Abrüstung gesprochen wurde, ist fahrlässig. Darum habe ic… https://t.co/lzxMMW19wn",[],43
1112823741548040192,2019-04-01 21:07:09,"Ich habe hier in New York übrigens überhaupt keine Sitzung verpasst, außer ein Pressestatement mit meinem franz. Ko… https://t.co/Rr2OuSPu0V",[],18
1112762096603840512,2019-04-01 17:02:12,"In Konflikten werden Helferinnen und Helfer angegriffen, um Angst zu verbreiten. Allein in Syrien gab es letztes Ja… https://t.co/ZAiIp63O6O",[],22
1112624365324193792,2019-04-01 07:54:54,Im @UN Sicherheitsrat werden wir uns für den Schutz von Frauen in Konflikten einsetzen.Sie gehören dort zu den erst… https://t.co/gxJFAQSeBj,[],16
1112621704277381120,2019-04-01 07:44:20,Wir werden im @UN Sicherheitsrat die Schutz humanitärer Helfer in den Fokus nehmen. Ärzte &amp; Helfer werden immer häu… https://t.co/y6YfZpRbpt,[],16
1112620823460888578,2019-04-01 07:40:50,Heute übernehmen wir den Vorsitz im @UN Sicherheitsrat. Da wir eine gefährliche Erosion internationaler Abrüstungsv… https://t.co/tKABbFkHjt,[],57
1111716819616886785,2019-03-29 19:48:39,"Die @UN-Mission in Mali verdient unsere volle Unterstützung, sie braucht weiter ein starkes, umfassendes Mandat. Da… https://t.co/gG8ve9MkjV",[],8
1111686686625488896,2019-03-29 17:48:54,"Uns läuft die Zeit davon, einen ungeordneten Brexit zu verhindern. Die Briten müssen sich vor dem 12. April entsche… https://t.co/HS2djZmcIu",[],32
1111664587009593346,2019-03-29 16:21:05,"Den Frieden müssen wir tagtäglich gewinnen. Dafür müssen wir investieren: in Peacekeeping, in Krisenprävention, in… https://t.co/iStquIrRxr",[],13
1110893102884184064,2019-03-27 13:15:29,"Frankreich und Deutschland haben im Aachener Vertrag vereinbart, dass mindestens einmal im Quartal ein Mitglied der… https://t.co/DdtXwufatT",[],42
1110498100114788352,2019-03-26 11:05:53,Vor 24 Jahren trat das Schengen-Abkommen in Kraft und die Grenzkontrollen zwischen den Mitgliedsstaaten verschwande… https://t.co/uRYal2zbAd,[],76
1110483056941559808,2019-03-26 10:06:07,"Bei der Europawahl treten Populisten und Nationalisten an, Europa kaputtzumachen. Aus dem Parlament, also von innen… https://t.co/MwrYBFc0vX",[],98
1110083876460920833,2019-03-25 07:39:55,Vor genau 62 Jahren unterschrieb die BRD die Römischen Verträge. Dabei entstanden die „Europäischen Gemeinschaften“… https://t.co/DhD6d9sJGl,[],96
1109772177082118146,2019-03-24 11:01:20,Die EU muss dringend außenpolitisch handlungsfähiger werden. Dafür müssen wir weg vom Grundsatz der Einstimmigkeit.… https://t.co/mhyGZlFOGp,[],59
1109756938991136768,2019-03-24 10:00:47,Wir Europäer und insbesondere wir Deutschen müssen noch mehr in Zukunftstechnologien investieren. Die Modernisierun… https://t.co/rEeANG4oqa,[],39
1109740904116613121,2019-03-24 08:57:04,In China werden Zukunftstechnologien auch zur Kontrolle der Bürger eingesetzt und in den USA sind sie auch Mittel z… https://t.co/hn1h7WLv1s,[],25
1109474337642430466,2019-03-23 15:17:49,Baghus ist befreit! Ein wichtiger Schritt ist getan. IS beherrscht kein Gebiet mehr. Möglich war das nur durch eine… https://t.co/iHtA1r5IQd,[],53
1109452412392300544,2019-03-23 13:50:42,"@SophiePassmann @joschueck Den lachenden Massen im Bild entnehme ich, dass sie sehr lustig waren.",[],3
1109395965889441798,2019-03-23 10:06:24,Wir beschließen heute beim SPD-Parteikonvent unser Programm für die Europawahl im Mai. Für uns ist klar: Die Antwor… https://t.co/Y3bMVuMpZc,[],115
1109349056193679361,2019-03-23 07:00:00,Die Worte von Otto Wels haben sich in unser aller Gedächtnis eingebrannt. Und das ist auch gut so. Noch wichtiger i… https://t.co/4Dp3sE5oPk,[],33
1109088393571504128,2019-03-22 13:44:13,"Mit Klaus Kinkel hat unser Land einen aufrechten Kämpfer für ein weltoffenes Deutschland verloren, einen großen Eur… https://t.co/btIemap9Gh",[],19
1109014223634472960,2019-03-22 08:49:30,Auch im Sicherheitsrat der @UN müssen wir viel mehr über den Klimawandel reden. Er wird weltweit immer mehr zur Gef… https://t.co/8kgiJad7Wv,[],82
1108625044715040770,2019-03-21 07:03:02,"Es reicht nicht, gegen Rassismus zu sein. Wann immer uns Rassismus begegnet, sei es bei der Arbeit, im Bus oder bei… https://t.co/FieVE96uSO",[],185
1108391860127580162,2019-03-20 15:36:27,Mit dem Brief von Theresa May ist noch kein Problem gelöst. Wenn der Europäische Rat über eine Fristverlängerung fü… https://t.co/LyhWqRdYEC,[],90
1108263648223477762,2019-03-20 07:06:58,Meine Lehre aus der deutschen Geschichte ist: nie und nirgendwo wegschauen. Der Nationalsozialismus und Holocaust w… https://t.co/uMXUfdKQ9S,[],196
1107635623408615424,2019-03-18 13:31:26,"RT @dreynders: 💬 Mein Kollege @HeikoMaas bei #DeBeKo2019:""Gemeinsam haben wir vorgeschlagen, einen Peer-Review Mechanismus zu etablieren,…","[{'text': 'DeBeKo2019', 'indices': [45, 56]}]",16
1107635610930561026,2019-03-18 13:31:23,"RT @dreynders: 💬 Mein Kollege @HeikoMaas bei #DeBeKo2019:""Um Akteur auf der Weltbühne zu bleiben muss Europa souveräner werden. #EuropaUn…","[{'text': 'DeBeKo2019', 'indices': [45, 56]}]",15
1107635600474234881,2019-03-18 13:31:20,"RT @dreynders: 💬 Mein Kollege @HeikoMaas bei #DeBeKo2019:""Die Verständigung auf gemeinsame Regeln ist die Basis unserer europäischen Erfo…","[{'text': 'DeBeKo2019', 'indices': [45, 56]}]",18
1107620173710794752,2019-03-18 12:30:02,".@dreynders: Ein solcher Peer-Review-Mechanismus würde präventiv wirken und uns helfen, glaubwürdig zu bleiben. Wie… https://t.co/mNyyvk2wM5",[],6
1107619969674682368,2019-03-18 12:29:14,".@dreynders: Wir schlagen deshalb gemeinsam einen Peer-Review-Mechanismus vor, um den Stand der Rechtsstaatlichkeit… https://t.co/iCGy8bW65Y",[],5
1107619572826415105,2019-03-18 12:27:39,".@dreynders: Europäisch zu sein, ist keine geographische Gegebenheit. Es ist eine politische Entscheidung.",[],24
1107619227438141440,2019-03-18 12:26:17,".@dreynders: Rechtsstaatlichkeit ist das, was uns als Europäer definiert. Zusammen mit dem Klimawandel ist es eines… https://t.co/n8DAV4GFKh",[],7
1107619091081101313,2019-03-18 12:25:44,".@dreynders: Wir brauchen eine ausgewogene Migrationspolitik, die das Völkerrecht respektiert, unsere Grenzen und d… https://t.co/nvar2YLCh5",[],9
1107618850370129924,2019-03-18 12:24:47,.@dreynders: Der Binnenmarkt ist noch nicht vollendet. In Bereichen wie Digitalisierung und Energie brauchen wir we… https://t.co/N1iFPjvUE7,[],4
1107617722228191232,2019-03-18 12:20:18,Ich spreche gleich bei der Deutsch-Belgischen Konferenz in Brüssel. Meine Rede twittert dankenswerterweise das Team… https://t.co/3zH3xK7eGt,[],7
1107537484605546496,2019-03-18 07:01:28,Frauen kriegen auch 2019 noch weniger Lohn als Männer. Statistisch haben sie von Neujahr bis heute umsonst gearbeit… https://t.co/2zW7DT1mLN,[],88
1106827445066334208,2019-03-16 08:00:01,"Den ungeregelten #Brexit kann niemand wollen. Lieber noch eine Ehrenrunde mit kurzer Verlängerung, bevor es dazu ko… https://t.co/oRMXqHzAOu","[{'text': 'Brexit', 'indices': [17, 24]}]",31
1106509042627817477,2019-03-15 10:54:48,The vicious terrorist attack in #Christchurch targeted peaceful Muslims at prayer. When people are murdered solel… https://t.co/qSDqq5tMdM,"[{'text': 'Christchurch', 'indices': [32, 45]}]",91
1106487575886344192,2019-03-15 09:29:30,"Autonome Waffen, Hyperschallraketen, Cyberkriege und Bio-Tech. Mit technologischen Entwicklungen geht menschliche V… https://t.co/o7RkJndeRc",[],21
1106467939388141569,2019-03-15 08:11:28,Der grausame Terroranschlag in #Christchurch trifft friedlich betende Muslime. Wenn Menschen allein wegen ihrer Rel… https://t.co/oxPGjqZMdU,"[{'text': 'Christchurch', 'indices': [31, 44]}]",671
1106448414198452224,2019-03-15 06:53:53,Wir sind tief erschüttert von dem brutalen Verbrechen in #Christchurch.In diesen schweren Stunden stehen wir fest… https://t.co/8xCeYhu8GA,"[{'text': 'Christchurch', 'indices': [57, 70]}]",78
1105936276597981189,2019-03-13 20:58:50,"Es ist ein Signal der Vernunft, das eben aus London gekommen ist. Das Unterhaus hat gezeigt, dass es mehrheitlich z… https://t.co/gsP1lQMwx5",[],44
1105844399240634368,2019-03-13 14:53:45,Bei Daniel Kriener und der Botschaft in Caracas habe ich mich heute für den unermüdlichen Einsatz und das Engagemen… https://t.co/e33kZr98cC,[],28
1105831976223805445,2019-03-13 14:04:23,"Der Richter am Internationalen Strafgerichtshof Christoph Flügge gewann in seinen Prozessen, u.a. gegen Ratko Mladi… https://t.co/QBr9RdWcRk",[],16
1105809415683346432,2019-03-13 12:34:44,Morgen werde ich genau ein Jahr als Außenminister im Amt sein. Zu dem Anlass will ich gern morgen gegen 11 Uhr Eure… https://t.co/MhC5U2Bqb2,[],55
1105718111838322688,2019-03-13 06:31:55,"Mit dem #brexitvote in UK rücken wir einem No-Deal-#Brexit immer näher. Wer das Abkommen ablehnt, spielt auf fahrlä… https://t.co/seGHN8bo86","[{'text': 'brexitvote', 'indices': [8, 19]}, {'text': 'Brexit', 'indices': [51, 58]}]",38
1105456522786689024,2019-03-12 13:12:28,"Dass die iranische Menschenrechtsanwältin #Sotudeh nun verurteilt worden ist, ist nicht nachvollziehbar. Wir forder… https://t.co/KPKIhj4jrv","[{'text': 'Sotudeh', 'indices': [42, 50]}]",158
1105144150289207297,2019-03-11 16:31:12,"38 Länder, 71 Orte, über 300.000 km im Flugzeug. Ein Jahr als Außenminister geht zu Ende. Wie war‘s und wie geht’s… https://t.co/Fk9tvkMpzd",[],11
1105039410091962368,2019-03-11 09:35:00,"Was #Afghanistan an Verbesserungen bei Menschenrechten und der Rechtsstaatlichkeit, aber auch für viele vor allem j… https://t.co/IHjFzbL9vT","[{'text': 'Afghanistan', 'indices': [4, 16]}]",15
1104828712569184257,2019-03-10 19:37:46,"Deutschland steht zu seiner Verantwortung, die wir als zweitgrößter Geber und Truppensteller in #Afghanistan überno… https://t.co/2j0Bnj8OmV","[{'text': 'Afghanistan', 'indices': [96, 108]}]",39
1104765541170991105,2019-03-10 15:26:45,Der schreckliche Absturz der Ethiopian-Airlines-Maschine in Richtung Nairobi hat vielen Menschen das Leben gekostet… https://t.co/KxfvS3FTcu,[],21
1104684067126108160,2019-03-10 10:03:00,"Rüstungskontrolle muss auf die Tagesordnung, auch für Cyberwaffen, Killerrobotics und autonome Systeme, denn es gib… https://t.co/vX0dL6iK5d",[],15
1104653364946784256,2019-03-10 08:01:00,"Der internationale Druck auf Maduro muss hoch bleiben. Wir sind in der EU bereit, zusätzliche Sanktionen zu verhäng… https://t.co/T9mO3sqPao",[],735
1104429603559559169,2019-03-09 17:11:51,"Dass deutsche Korrespondenten ihrer Arbeit in der Türkei nicht frei nachgehen können, ist für uns inakzeptabel. Das… https://t.co/MZX6O10nFn",[],82
1103944695284027393,2019-03-08 09:05:00,"Es gibt - mindestens - einen wirklich guten Grund, diesen #Weltfrauentag zu feiern. Er regt gesellschaftliche Debat… https://t.co/nZqn5pdFxg","[{'text': 'Weltfrauentag', 'indices': [58, 72]}]",38
1103928841012199424,2019-03-08 08:02:00,"Dass Frauen die gleichen Chancen bekommen, ist ein Gebot der Vernunft. Denn eine Politik, die die Bedürfnisse und d… https://t.co/8oQM5BXaAM",[],39
1103912986132004864,2019-03-08 06:59:00,Keine echte Demokratie ohne Gleichstellung. Darum müssen sich Demokratinnen und Demokraten ohne Wenn und Aber für G… https://t.co/Lzxrz7Bjww,[],113
1103593120510418944,2019-03-07 09:47:58,Eine Außenpolitik für Frauen kann nur eine Außenpolitik von und mit Frauen sein. Wir setzen uns im Sicherheitsrat e… https://t.co/lqNfll2IhC,[],73
1103357383093485572,2019-03-06 18:11:14,"Wir haben die Entscheidung, Botschafter Kriener zur „persona non grata“ zu erklären, zur Kenntnis genommen. Ich hab… https://t.co/ocTC1GCPo8",[],64
1103357380962799621,2019-03-06 18:11:13,"Unseren Botschafter aus Venezuela auszuweisen, ist eine unverständliche Entscheidung, die die Lage verschärft und e… https://t.co/pNXRcuV8Xu",[],164
1103188463606743040,2019-03-06 07:00:00,Eine Debatte über Europas Zukunft tut der europäischen Demokratie gut. Dazu gibt @EmmanuelMacron wertvolle Impulse.… https://t.co/IJHJ3dkL9A,[],74
1102986235574927362,2019-03-05 17:36:25,Die Hälfte der Macht für die Hälfte der Bevölkerung: Von der Kommune bis nach Europa müssen Frauen und Männer endli… https://t.co/DQCKf1tuny,[],56
1102857002504589312,2019-03-05 09:02:54,Wir trauern um Klaus #Kinkel. Unser Land verliert einen großen Liberalen und Kämpfer für Rechtsstaat &amp; Demokratie.… https://t.co/k6WW1FVLZH,"[{'text': 'Kinkel', 'indices': [21, 28]}]",93
1102825970329886722,2019-03-05 06:59:35,"Vor 49 Jahren trat der Atomwaffensperrvertrag in Kraft. 191 Staaten verpflichten sich mit ihm, keine Atomwaffen zu… https://t.co/FbwXeZr8NG",[],66
1102663128494559233,2019-03-04 20:12:30,"Schon Mitte des 12. Jahrhunderts stand die Hanse für den Abbau von Schranken, für gemeinsame Investitionen in Siche… https://t.co/SVCsw6arQl",[],35
1102647190332338176,2019-03-04 19:09:11,Die Europäische Union war bislang vor allem ein nach innen gerichtetes Projekt. Dieses nach innen gerichtete Europa… https://t.co/vXqJAw2P3T,[],24
1102608200178782208,2019-03-04 16:34:15,Wir müssen die Globalisierung gerecht gestalten und dafür brauchen wir mehr Zusammenarbeit - nicht weniger. Ohne fa… https://t.co/effecbDmeB,[],18
1102587262901108737,2019-03-04 15:11:03,Pressefreiheit ist das Fundament einer demokratischen Gesellschaft. JournalistInnen müssen Ihrer Arbeit frei und… https://t.co/eVxY7JylJB,[],120
1101780823718707201,2019-03-02 09:46:33,"Er ist der Vater von Glasnost und Perestroika, er beendete den Kalten Krieg und trug maßgeblich zur Wiedervereinigu… https://t.co/YuaTgPUnwz",[],101
1101525375279157248,2019-03-01 16:51:29,Wir starten! Herzlichen Dank an die gesamte Crew für den professionellen Umgang mit der Situation und den schnellen… https://t.co/KCC5LFDBkg,[],50
1101160509091524608,2019-02-28 16:41:38,Habe in Mali unsere Soldatinnen und Soldaten besucht. Sie leisten dort einen entscheidenden Beitrag für den Frieden… https://t.co/xeec93evYv,[],47
1101028371344117760,2019-02-28 07:56:34,"Wir bedauern sehr, dass der #TrumpKimSummit abgebrochen worden ist. Gelänge es, das nordkoreanische Atomprogramm zu… https://t.co/2lt4q9qZeD","[{'text': 'TrumpKimSummit', 'indices': [28, 43]}]",39
1100399423559892992,2019-02-26 14:17:21,"Der @ersterfcs wurde letzte Saison Meister der Regionalliga Südwest, der @SV07Elversberg vorletzte. Dafür muss man… https://t.co/lPwoeJartQ",[],7
1100356413573005313,2019-02-26 11:26:27,Im #Jemen herrscht die größte humanitäre Krise weltweit. Unsere Menschenrechtsbeauftragte @BaerbelKofler wird heute… https://t.co/O1fMpstC2s,"[{'text': 'Jemen', 'indices': [3, 9]}]",24
1100079403554488324,2019-02-25 17:05:42,"#Heimat ist zu wertvoll, um sie Konservativen und Populisten zu überlassen. Sie wird für mich durch gemeinsame Wert… https://t.co/IvlAtzYjks","[{'text': 'Heimat', 'indices': [0, 7]}]",129
1099579684763779072,2019-02-24 08:00:00,"Wenn Jüdinnen und Juden in Europa wieder Angst haben, ist das beschämend für uns alle. Jeder einzelne Angriff auf s… https://t.co/kO7MSKTXyy",[],240
1099346073829756930,2019-02-23 16:31:43,"Wir haben heute den 100. Geburtstag von Helmut Schmidt gefeiert. Diskutierend, was er uns heute wohl zu sagen hätte… https://t.co/bxPO8fcuGo",[],92
1098888084274458624,2019-02-22 10:11:50,Die EU muss außenpolitisch handlungsfähiger werden. Wir müssen weg vom Fluch der Einstimmigkeit. Für die Einführung… https://t.co/aVn6YRDlzQ,[],35
1098856995661275136,2019-02-22 08:08:18,"Wir brauchen neue Abrüstungsinitiativen, denen sich mehr Staaten anschließen als bisher und die nicht nur Nuklearwa… https://t.co/eCGIKJUySj",[],48
1098840651301617664,2019-02-22 07:03:21,"Die #WeißeRose war ein Leuchtturm der Menschlichkeit in der dunklen NS-Zeit. Wo andere schwiegen, sprachen sie von… https://t.co/bfyiqIzn5X","[{'text': 'WeißeRose', 'indices': [4, 14]}]",271
1098614822214795266,2019-02-21 16:05:59,"Wenn wir in Afghanistan erreichen wollen, dass es künftig nicht nur um Terrorismusbekämpfung geht und dass Menschen… https://t.co/rfiBSfN2PN",[],24
1098500973012676609,2019-02-21 08:33:35,"Vor 103 Jahren begann die Schlacht um Verdun. Eine Materialschlacht, in der niemand etwas gewann aber um die 800.00… https://t.co/z6HbzO1Qjw",[],116
1098118746978304000,2019-02-20 07:14:45,"Heute vor 45 Jahren stimmte der Bundestag dem Atomwaffensperrvertrag zu. Er verbietet es kernwaffenlosen Staaten, A… https://t.co/9yh3jvjKWT",[],106
1097940363610898433,2019-02-19 19:25:56,"Meine Generation und alle, die jünger sind, kennen nur den Frieden. Aber der Frieden ist nicht selbstverständlich.… https://t.co/fvwdsV72WE",[],70
1097760125656449024,2019-02-19 07:29:44,Marie #Juchacz sprach vor 100 Jahren als erste Frau in einem deutschen Parlament - das bestand damals zu 10 % aus F… https://t.co/lyodk1UuEj,"[{'text': 'Juchacz', 'indices': [6, 14]}]",95
1097501096745058305,2019-02-18 14:20:26,#EuropeUnited https://t.co/cW8BOEOkJs,"[{'text': 'EuropeUnited', 'indices': [0, 13]}]",142
1097487869973852160,2019-02-18 13:27:53,"Der #Jemen-Konflikt ist der Konflikt, der im Moment am ehesten politisch gelöst werden kann. Deutschland wird sich… https://t.co/umfS24Frks","[{'text': 'Jemen', 'indices': [4, 10]}]",14
1097391032159883264,2019-02-18 07:03:05,#SchwarzRotGold wurde heute vor 100 Jahren zum ersten Mal ganz offiziell deutsches Nationalsymbol. Es sind die Farb… https://t.co/myKFcWHKyV,"[{'text': 'SchwarzRotGold', 'indices': [0, 15]}]",141
1097178511159234560,2019-02-17 16:58:36,"Heute Abend bin ich um 21.45 Uhr bei @annewill zum Thema ""Die neue Welt-Unordnung"". Für mich ist klar: Gerade in ei… https://t.co/gAeapKcz5R",[],49
1097078925593858048,2019-02-17 10:22:53,It was great to meet @SpeakerPelosi and members of the US Congress at #MSC19. Our transatlantic friendship based on… https://t.co/VX7BELXZu1,"[{'text': 'MSC19', 'indices': [70, 76]}]",37
1096884169987231745,2019-02-16 21:28:59,Gerade konnte ich den Premierministern von Griechenland und Nordmazedonien @atsipras und @Zoran_Zaev zum Ewald-von-… https://t.co/GSPToenRfl,[],36
1096727678017785856,2019-02-16 11:07:09,"Bruno Ganz ist tot. Einer der bedeutendsten Schauspieler unserer Zeit geht, sein fulminantes Werk bleibt. Wir traue… https://t.co/04BrgN3DDV",[],40
1096717773751881728,2019-02-16 10:27:47,Bei der #MSC19 wünsche ich mir ein klares Bekenntnis zum transatlantischen Verhältnis von beiden Seiten. Und ich bi… https://t.co/hfMnW3OI4k,"[{'text': 'MSC19', 'indices': [8, 14]}]",13
1096467020776964096,2019-02-15 17:51:23,Jede und jeder muss spüren: Internationale Zusammenarbeit zahlt sich für uns aus. Internationale Zusammenarbeit bed… https://t.co/VNGm43CEhQ,[],26
1096467018348462085,2019-02-15 17:51:23,Abstiegsängste sind die Ursache für die Krise des Multilateralismus. Wenn Populismus und Nationalismus sich wie Ros… https://t.co/IueyqU2cjw,[],67
